<?xml version="1.0" encoding="UTF-8"?>
<xs:schema attributeFormDefault="unqualified" elementFormDefault="qualified" xmlns:xs="http://www.w3.org/2001/XMLSchema">
  <xs:element name="root" type="rootType"/>
  <xs:complexType name="rootType">
    <xs:sequence>
      <xs:element type="texturesType" name="textures"/>
      <xs:element type="spritesType" name="sprites"/>
    </xs:sequence>
  </xs:complexType>
  <xs:complexType name="spriteType">
    <xs:sequence>
      <xs:element type="clipType" name="clip" maxOccurs="unbounded" minOccurs="0"/>
    </xs:sequence>
    <xs:attribute type="xs:string" name="name" use="optional"/>
  </xs:complexType>
  <xs:complexType name="spritesType">
    <xs:sequence>
      <xs:element type="spriteType" name="sprite" maxOccurs="unbounded" minOccurs="0"/>
    </xs:sequence>
  </xs:complexType>
  <xs:complexType name="textureType">
    <xs:simpleContent>
      <xs:extension base="xs:string">
        <xs:attribute type="xs:string" name="name" use="optional"/>
        <xs:attribute type="xs:string" name="file" use="optional"/>
      </xs:extension>
    </xs:simpleContent>
  </xs:complexType>
  <xs:complexType name="texturesType">
    <xs:sequence>
      <xs:element type="textureType" name="texture" maxOccurs="unbounded" minOccurs="0"/>
    </xs:sequence>
  </xs:complexType>
  <xs:complexType name="clipType">
    <xs:simpleContent>
      <xs:extension base="xs:string">
        <xs:attribute type="xs:string" name="texture" use="optional"/>
        <xs:attribute type="xs:string" name="x" use="optional"/>
        <xs:attribute type="xs:string" name="y" use="optional"/>
        <xs:attribute type="xs:string" name="w" use="optional"/>
        <xs:attribute type="xs:string" name="h" use="optional"/>
      </xs:extension>
    </xs:simpleContent>
  </xs:complexType>
</xs:schema>